Site tiles,URL
The rise in automation and what it means for the future - The ...,"https://www.weforum.org/agenda/2021/04/the-rise-in-automation-and-what-it-means-for-the-future/#:~:text=Automation%20has%20shown%20significant%20progression,steer%20people%20towards%20other%20opportunities."
Automation And The Future Of Work - Forbes,https://www.forbes.com/sites/anniebrown/2021/06/02/automation-and-the-future-of-workhow-engineered-systems-are-improving-the-workplace/
A new study measures the actual impact of robots on jobs. It's,https://mitsloan.mit.edu/ideas-made-to-matter/a-new-study-measures-actual-impact-robots-jobs-its-significant
The future of robotics and automation relies on workers with advanced ...,https://www.bizjournals.com/cincinnati/news/2020/12/14/the-future-of-robotics-and-automation-relies-on-wo.html
"AI, automation, and the future of work: Ten things to solve for",https://www.mckinsey.com/featured-insights/future-of-work/ai-automation-and-the-future-of-work-ten-things-to-solve-for
Automation And The Future Of Work - Forbes,https://www.forbes.com/sites/anniebrown/2021/06/02/automation-and-the-future-of-workhow-engineered-systems-are-improving-the-workplace/
The Future Is Both Automated And Intelligent - Forbes,https://www.forbes.com/sites/forbestechcouncil/2021/04/08/the-future-is-both-automated-and-intelligent/
What is the Future of Automation | HCL Technologies,https://www.hcltech.com/technology-qa/the-future-of-automation
10 Thinkers on the Future of Automation | BlueBotics,https://bluebotics.com/future-of-automation/
What the Future of Automation Looks Like (& How to Get ...,https://blog.hubspot.com/marketing/what-the-future-of-automation-looks-like-and-how-to-get-ahead-right-now
AI and Automation Are Reshaping the Future of Work - Marsh ...,https://www.mmc.com/insights/publications/2019/sep/ai-and-automation-are-reshaping-the-future-of-work.html
Top 6 Future Trends in Robotic Automation,https://www.automate.org/blogs/top-6-future-trends-in-robotic-automation
Exploring the impact of automation and new technologies on ...,https://equitablegrowth.org/exploring-the-impact-of-automation-and-new-technologies-on-the-future-of-u-s-workers-and-their-families/
Automation and the future of work | IBM,https://www.ibm.com/thought-leadership/institute-business-value/report/automation-workflows
Automation is making human labor more valuable than ever,https://www.vox.com/a/new-economy-future/manual-labor-luxury-good
Automation and the future of work: Assessing the role of labor ...,https://www.sciencedirect.com/science/article/pii/S1094202521000570
"Automation and the Future of Work, Aaron Benanav - Verso ...",https://www.versobooks.com/books/3717-automation-and-the-future-of-work
The Future of Automation: Will Robots Take Your Job?,https://blog.isa.org/the-future-of-automation-will-robots-take-your-job
What Is the Future for Automation Engineers ? | ARC Advisory,https://www.arcweb.com/industry-best-practices/what-future-automation-engineers
"Job automation, technology and the future of work - United ...",https://www.ufcw.org/better/technology-and-the-future-of-work/
"Digitalization, Automation and the Future of Work | Projects",https://www.exc.uni-konstanz.de/en/inequality/research/projects/digitalization-automation-and-the-future-of-work/
The Future of Work Automation - Smartsheet,https://www.smartsheet.com/content-center/product-news/automation/future-of-automation
Automation & The Future Of Work: How Can You Prepare?,https://www.cxcglobal.com/future-work-automation/amp/
12 jobs that AI will replace in future - Saviom,https://www.saviom.com/blog/12-jobs-that-robots-ai-will-replace-in-the-future-and-12-that-wont/
How the Future of Automation will Transform Business - NIX ...,https://nix-united.com/blog/the-future-of-automation/
How recession and automation is changing the future of work,https://www.theceomagazine.com/business/innovation-technology/future-of-work/
The Future of Jobs in the Era of AI | BCG,https://www.bcg.com/publications/2021/impact-of-new-technologies-on-jobs
Automation and the Future of Work: Scenarios and Policy ...,https://www.cigionline.org/publications/automation-and-future-work-scenarios-and-policy-options/
Artificial Intelligence and Automation 2022 - AI - Datamation,https://www.datamation.com/artificial-intelligence/artificial-intelligence-and-automation/
"A future that works: automation, employment, and productivity",https://www.voced.edu.au/content/ngv%3A75268
Automation and the future of jobs – optimism or pessimism ...,https://www.futureofworkhub.info/comment/2020/11/19/automation-and-the-future-of-jobs-optimism-or-pessimism-ahead
Digital automation and the future of work,https://www.europarl.europa.eu/RegData/etudes/STUD/2021/656311/EPRS_STU(2021)656311_EN.pdf
Digital automation and the future of work | Think Tank,https://www.europarl.europa.eu/thinktank/en/document.html?reference=EPRS_STU(2021)656311
What the Future Holds for Robotic Process Automation,https://www.cio.com/article/189619/what-the-future-holds-for-robotic-process-automation-the-next-chapter.html
Future of Automation: Robots Are Coming But Wont Take Jobs,https://www.digitaltrends.com/features/the-future-of-automation/
Is The Future of Automation in the Manufacturing Sector ...,https://www.techbriefs.com/component/content/article/tb/pub/features/articles/39983
6 Predictions About the Future of Automation - Evolve ETFs,https://evolveetfs.com/2019/06/6-predictions-about-the-future-of-automation/
The future of data quality: why automation holds the key - The ...,https://www.the-gma.com/the-future-of-data-quality-why-automation-holds-the-key
TIA future technologies | Totally Integrated Automation (TIA),https://new.siemens.com/global/en/products/automation/topic-areas/tia/future-topics.html
Future of Automation,https://www.automationmag.com/virtual-events/future-of-automation/
"Taxes, Automation, and the Future of Labor",https://workofthefuture.mit.edu/research-post/taxes-automation-and-the-future-of-labor/
The Future of Industrial Automation,https://www.automation.com/en-us/articles/2003-2/the-future-of-industrial-automation
Our Automated Future | The New Yorker,https://www.newyorker.com/magazine/2016/12/19/our-automated-future
Future of Automation in India - LinkedIn,https://www.linkedin.com/pulse/future-automation-india-aswajit-boro
Five ways automation will help businesses - LAC Conveyors,https://www.lacconveyors.co.uk/future-of-automation/
Automation has changed the future of work. What about people?,https://diginomica.com/automation-future-work-people
What is the future for automation industry? - Quora,https://www.quora.com/What-is-the-future-for-automation-industry
"Women, Automation, and the Future of Work - IWPR",https://iwpr.org/iwpr-issues/esme/women-automation-and-the-future-of-work/
Robo-Apocalypse cancelled? Reframing the automation and ...,https://journals.sagepub.com/doi/abs/10.1177/0268396220925830
"Move Over Automation, the Future of Finance Is Autonomous",https://www.paymentsjournal.com/move-over-automation-the-future-of-finance-is-autonomous/
"Artificial Intelligence, Automation and the Future of ...",https://www.routledge.com/Artificial-Intelligence-Automation-and-the-Future-of-Competence-at-Work/Johannessen/p/book/9780367640460
5 Problems Automation Will Solve in the Future Workplace,https://www.konicaminolta.com.au/news-insight/blog/automation-in-future-workplace
What Lies Ahead in the Future of Automation? - Analytics Insight,https://www.analyticsinsight.net/lies-ahead-future-automation/
Future of Work: Automation and Work Trends | Autodesk,https://www.autodesk.com.sg/future-of-work
AI and automation: how can the UK prepare for the future of ...,https://www.newstatesman.com/spotlight/2021/11/ai-and-automation-how-can-the-uk-prepare-for-the-future-of-work
The Future of Automation – A Guide to What's Next - RS ...,https://uk.rs-online.com/web/generalDisplay.html?id=ideas-and-advice/future-automation-guide
Mapping your journey into the future: intelligent automation,https://www.genpact.com/insight/point-of-view/mapping-your-journey-into-the-future-intelligent-automation
The Future of Robotics and Automation in Manufacturing | PLEX,https://www.plex.com/platform/manufacturing-automation/future-robotics-and-automation
Top 10 Automation Trends in 2022 - UiPath,https://www.uipath.com/blog/automation/top-automation-trends-2022
Robotics and the Future of Production and Work | ITIF,https://itif.org/publications/2019/10/15/robotics-and-future-production-and-work
"Aaron Benanav, Automation and the Future of Work—1, NLR ...",https://newleftreview.org/issues/ii119/articles/aaron-benanav-automation-and-the-future-of-work-1
The Future of Work — Part One - Marker (Medium),https://marker.medium.com/the-future-of-work-part-one-d51ebc64e1ea
Being Human in the Time of Automation - Salesforce Blog,https://www.salesforce.com/ap/blog/2021/08/automation-technologies-being-human.html
Being Human in the Time of Automation - Salesforce Blog,https://www.salesforce.com/ap/blog/2021/08/automation-technologies-being-human.html
The Evolution and Future Scope of Industrial Automation,https://wisdomplexus.com/blogs/industrial-automation-future-scope/
"how UK innovation is driven by AI, automation and robotics",https://natwestbusinesshub.com/articles/future-business-how-uk-innovation-is-driven-by-ai-automation-and-robotics
Automation: The Future of Manufacturing Is Here | 2020-08-01,https://www.qualitymag.com/articles/96158-automation-the-future-of-manufacturing-is-here
"Automation and the Future of Work : Benanav, Aaron",https://www.amazon.sg/Automation-Future-Work-Aaron-Benanav/dp/1839761296
The future of knowledge work - Deloitte,https://www2.deloitte.com/content/dam/insights/us/articles/the-future-of-knowledge-work/DUP416_The-future-of-knowledge-work.pdf
The future of work is automation: How not to be replaced,https://blog.airslate.com/future-work-automation-avoid-replacement/
Full article: Repoliticising the future of work: automation and ...,https://www.tandfonline.com/doi/full/10.1080/17530350.2022.2028651
Is Automation the Future of the Supply Chain?,https://supplychaindigital.com/technology/automation-future-supply-chain
"Automation and AI sound similar, but may have vastly different ...",https://www.brookings.edu/blog/the-avenue/2020/01/29/automation-and-artificial-intelligence-sound-similar-but-may-have-vastly-different-impacts-on-the-future-of-work/
"Era of Automation, Future of Work | USA - Samsung SDS",https://www.samsungsds.com/us/blog/automation.html
Debating the Future of Work: The Perception and ... - Frontiers,https://www.frontiersin.org/articles/10.3389/fpsyg.2020.01965/full
Future Trends for Robotics and Automation,https://www.robotics247.com/article/insights_on_future_trends_for_robotics_and_automation
Why Hyperautomation is the future of Intelligent Automation,https://www.aurora-ecs.com/insights/why-hyperautomation-is-the-future-of-intelligent-automation/
Workforce of the future - The competing forces shaping 2030,https://www.pwc.com/gx/en/services/people-organisation/publications/workforce-of-the-future.html
Automation and the Future of the Workplace,https://www.theautomationengineer.com/insight/automation-and-the-future-of-the-workplace/
How Will Automation Affect the Future Workplace? - CMSWire,https://www.cmswire.com/digital-workplace/how-will-automation-affect-the-future-workplace/
Automation and the Future of Work | Philosophy Talk,https://www.philosophytalk.org/blog/automation-and-future-work
The future of automation: a more integrated outlook,https://www.thinkautomation.com/future-of-work/the-future-of-automation-a-more-integrated-outlook/
"The future of jobs: Automation technologies, robotics, and ...",https://www.zdnet.com/article/the-future-of-jobs-automation-technologies-robotics-and-artificial-intelligence/
"To Prepare for Automation, Stay Curious and Don't Stop ...",https://hbr.org/2019/10/to-prepare-for-automation-stay-curious-and-dont-stop-learning
The Future of Work is Now: Is APAC Ready? Autodesk ...,https://damassets.autodesk.net/content/dam/autodesk/www/campaigns/future-of-work/the-future-of-work-is-now-deloitte-2021.pdf
The Future of Industrial Automation,https://www.rockwellautomation.com/en-za/company/news/blogs/the-future-of-industrial-automation.html
Automation and the future of work - Parliament (publications),https://publications.parliament.uk/pa/cm201719/cmselect/cmbeis/1093/109302.htm
Are You Ready For AI And Automation? - Forrester,https://www.forrester.com/blogs/are-you-ready-for-ai-and-automation/
Data automation: the future of data analytics - Unit4,https://www.unit4.com/blog/data-automation-future-data-analytics
Future Automation - TV Lifts | TV Wall Mounts | Projector ...,https://www.futureautomation.co.uk/
3 Reasons Intelligent Automation Is the Future of Finance,https://www.sutherlandglobal.com/our-thinking/3-reasons-intelligent-automation-is-the-future-of-finance
Automation will disrupt the future of global development - Devex,https://www.devex.com/news/automation-will-disrupt-the-future-of-work-but-also-the-future-of-global-development-90713
Automation and the Future of Jobs (2016) - IMDb,https://www.imdb.com/title/tt5699696/
Automation in the Lab of the Future Infographic - Technology ...,https://www.technologynetworks.com/informatics/infographics/automation-in-the-lab-of-the-future-345858
"Rise of the Machines: The Future has Lots of Robots, Few Jobs",https://www.wired.com/brandlab/2015/04/rise-machines-future-lots-robots-jobs-humans/
How automation and augmentation will change the future of HR,https://www.capgemini.com/resources/how-automation-and-augmentation-will-change-the-future-of-hr/
The Future of Advanced Automation and Robotics Jobs - ARM,https://arminstitute.org/future-robotics-and-automation-jobs/
5 investors discuss the future of RPA after UiPath's IPO,https://techcrunch.com/2021/05/07/5-investors-discuss-the-future-of-rpa-after-uipaths-ipo/
Future of finance: Extreme automation,https://advisory.kpmg.us/articles/2019/extreme-automation.html
Will A Robot Take Your Job? AI & The Future Of Jobs | Built In,https://builtin.com/artificial-intelligence/ai-replacing-jobs-creating-jobs
